{
  "$schema": "./schema/mechanics.schema.json",
  "schemaVersion": 1,
  "kind": "controls",
  "targetBuild": "21020021",
  "facts": [
    {
      "id": "controls-keyboard-move",
      "statement": "Keyboard movement uses A and D as a digital horizontal axis.",
      "status": "confirmed",
      "value": { "left": "A", "right": "D" },
      "unit": "binding",
      "confidence": "medium",
      "tolerance": { "kind": "behavioral", "value": "rebindable equivalent allowed", "unit": "binding" },
      "method": "Cross-checked public gameplay conventions and the moveset description.",
      "sources": ["wiki-moveset", "footage-wcg", "footage-ssag"]
    },
    {
      "id": "controls-keyboard-jump",
      "statement": "Keyboard jump uses Space.",
      "status": "confirmed",
      "value": "Space",
      "unit": "binding",
      "confidence": "medium",
      "tolerance": { "kind": "behavioral", "value": "rebindable equivalent allowed", "unit": "binding" },
      "method": "Used the moveset description and visible PRESS JUMP TO JOIN flow.",
      "sources": ["wiki-moveset", "footage-wcg"]
    },
    {
      "id": "controls-mouse-aim",
      "statement": "Mouse position supplies a continuous world-space aim direction around the player.",
      "status": "confirmed",
      "value": "cursor relative to player",
      "unit": "aim mapping",
      "confidence": "high",
      "tolerance": { "kind": "behavioral", "value": "full 360 degree aim", "unit": "behavior" },
      "method": "Tracked the cursor, arm, and barrel direction in both recordings.",
      "sources": ["footage-wcg", "footage-ssag"]
    },
    {
      "id": "controls-mouse-fire",
      "statement": "Primary mouse button fires the gun.",
      "status": "confirmed",
      "value": "Mouse1",
      "unit": "binding",
      "confidence": "medium",
      "tolerance": { "kind": "behavioral", "value": "rebindable equivalent allowed", "unit": "binding" },
      "method": "Used community control description and observed cursor-led firing.",
      "sources": ["wiki-moveset", "footage-wcg", "footage-ssag"]
    },
    {
      "id": "controls-mouse-block",
      "statement": "Secondary mouse button activates block.",
      "status": "confirmed",
      "value": "Mouse2",
      "unit": "binding",
      "confidence": "medium",
      "tolerance": { "kind": "behavioral", "value": "rebindable equivalent allowed", "unit": "binding" },
      "method": "Used community control description and observed shield timing.",
      "sources": ["wiki-moveset", "footage-wcg", "footage-ssag"]
    },
    {
      "id": "controls-aim-independent",
      "statement": "Aim direction is independent of horizontal movement direction.",
      "status": "confirmed",
      "value": true,
      "unit": "rule",
      "confidence": "high",
      "tolerance": { "kind": "behavioral", "value": "move and shoot in opposite directions", "unit": "behavior" },
      "method": "Observed backward firing and air control in both recordings.",
      "sources": ["footage-wcg", "footage-ssag"]
    },
    {
      "id": "controls-fire-semantics",
      "statement": "Holding fire repeats shots whenever the attack cooldown and ammunition permit.",
      "status": "estimate",
      "value": "held repeat",
      "unit": "input semantics",
      "confidence": "medium",
      "tolerance": { "kind": "behavioral", "value": "no faster than cooldown", "unit": "rule" },
      "method": "Compared multi-shot firing cadence where press edges were not visible.",
      "sources": ["footage-wcg", "footage-ssag"]
    },
    {
      "id": "controls-jump-buffer",
      "statement": "The clone should accept jump input for four ticks before landing to preserve the original's forgiving feel.",
      "status": "open",
      "value": 4,
      "unit": "ticks",
      "confidence": "low",
      "tolerance": { "kind": "range", "value": [0, 6], "unit": "ticks" },
      "method": "Footage cannot distinguish buffering from precise player input, so the smallest useful buffer is provisional.",
      "sources": ["footage-wcg", "footage-ssag"]
    },
    {
      "id": "controls-controller-layout",
      "statement": "Controller support must expose move, aim, jump, fire, and block, but exact default button labels remain a verification item.",
      "status": "open",
      "value": { "leftStick": "move", "rightStick": "aim", "faceSouth": "jump", "rightTrigger": "fire", "leftTrigger": "block" },
      "unit": "provisional binding",
      "confidence": "low",
      "tolerance": { "kind": "behavioral", "value": "all five actions reachable", "unit": "behavior" },
      "method": "The selected recordings use keyboard and mouse and the live automation could not navigate into controller options.",
      "sources": ["runtime-build-21020021", "footage-wcg", "footage-ssag"]
    }
  ]
}
