{
  "$schema": "./schema/mechanics.schema.json",
  "schemaVersion": 1,
  "kind": "player",
  "targetBuild": "21020021",
  "facts": [
    {
      "id": "player-diameter",
      "statement": "One base player body diameter is the spatial normalization unit.",
      "status": "confirmed",
      "value": 1.0,
      "unit": "player diameters",
      "confidence": "high",
      "tolerance": { "kind": "exact", "value": 0, "unit": "player diameters" },
      "method": "Defines the project unit and anchors all footage normalization.",
      "sources": ["footage-wcg", "footage-ssag"]
    },
    {
      "id": "player-base-health",
      "statement": "Base maximum health is normalized to one.",
      "status": "confirmed",
      "value": 1.0,
      "unit": "health ratio",
      "confidence": "high",
      "tolerance": { "kind": "exact", "value": 0, "unit": "health ratio" },
      "method": "Defines the health unit used by proportional card and damage values.",
      "sources": ["wiki-moveset", "footage-wcg", "footage-ssag"]
    },
    {
      "id": "player-body-shape",
      "statement": "The damage and environment collider is approximately circular, while arms, gun, face, and hat are presentation.",
      "status": "estimate",
      "value": "circle",
      "unit": "collider shape",
      "confidence": "medium",
      "tolerance": { "kind": "behavioral", "value": "stable rolling contact and radial hits", "unit": "behavior" },
      "method": "Compared rotating body silhouettes, ledge contacts, and projectile impacts.",
      "sources": ["footage-wcg", "footage-ssag"]
    },
    {
      "id": "player-run-speed",
      "statement": "Base sustained horizontal speed is about 0.09 player diameters per simulation tick.",
      "status": "estimate",
      "value": 0.09,
      "unit": "player diameters per tick",
      "confidence": "medium",
      "tolerance": { "kind": "absolute", "value": 0.04, "unit": "player diameters per tick" },
      "method": "Normalized two early-match trajectories whose visible starting cards do not alter movement; the slower observation is a lower bound because the sample may include acceleration.",
      "sources": ["footage-wcg", "footage-ssag"]
    },
    {
      "id": "player-ground-acceleration",
      "statement": "Ground control reaches sustained speed in roughly eight ticks.",
      "status": "estimate",
      "value": 0.014,
      "unit": "player diameters per tick squared",
      "confidence": "low",
      "tolerance": { "kind": "absolute", "value": 0.006, "unit": "player diameters per tick squared" },
      "method": "Provisional tuning hypothesis derived by dividing the sustained-speed target by an eight-tick response target; the selected footage does not isolate the full acceleration ramp.",
      "sources": ["footage-wcg", "footage-ssag"]
    },
    {
      "id": "player-air-control-ratio",
      "statement": "Airborne horizontal control retains most ground authority.",
      "status": "estimate",
      "value": 0.8,
      "unit": "ground acceleration ratio",
      "confidence": "medium",
      "tolerance": { "kind": "range", "value": [0.65, 1.0], "unit": "ground acceleration ratio" },
      "method": "Provisional tuning hypothesis constrained by visible airborne corrections; the selected footage does not isolate equal-duration ground and air input.",
      "sources": ["footage-wcg", "footage-ssag"]
    },
    {
      "id": "player-jump-capacity",
      "statement": "A player stores one jump that may be used on the ground or in the air and is restored by ground contact.",
      "status": "confirmed",
      "value": 1,
      "unit": "stored jumps",
      "confidence": "medium",
      "tolerance": { "kind": "exact", "value": 0, "unit": "stored jumps" },
      "method": "Cross-checked the moveset description with ledge-fall and grounded-jump sequences.",
      "sources": ["wiki-moveset", "footage-wcg", "footage-ssag"]
    },
    {
      "id": "player-jump-speed",
      "statement": "A base jump begins near 0.21 player diameters per tick upward.",
      "status": "estimate",
      "value": 0.21,
      "unit": "player diameters per tick",
      "confidence": "low",
      "tolerance": { "kind": "absolute", "value": 0.04, "unit": "player diameters per tick" },
      "method": "Algebraic implementation hypothesis derived from the measured jump-height and time-to-apex bands rather than a direct frame-to-frame launch-velocity observation.",
      "sources": ["footage-wcg", "footage-ssag"]
    },
    {
      "id": "player-gravity",
      "statement": "Base airborne gravity is near 0.009 player diameters per tick squared.",
      "status": "estimate",
      "value": 0.009,
      "unit": "player diameters per tick squared",
      "confidence": "low",
      "tolerance": { "kind": "absolute", "value": 0.0025, "unit": "player diameters per tick squared" },
      "method": "Algebraic implementation hypothesis derived from the measured jump-height and time-to-apex bands rather than a direct acceleration observation.",
      "sources": ["footage-wcg", "footage-ssag"]
    },
    {
      "id": "player-jump-apex-height",
      "statement": "A base jump rises roughly 2.6 player diameters above takeoff.",
      "status": "estimate",
      "value": 2.6,
      "unit": "player diameters",
      "confidence": "low",
      "tolerance": { "kind": "absolute", "value": 0.8, "unit": "player diameters" },
      "method": "Compared visible rise intervals and apex body centers against the measured player diameter in two early-match samples; one bound starts after takeoff and one arc includes a shot.",
      "sources": ["footage-wcg", "footage-ssag"]
    },
    {
      "id": "player-jump-apex-time",
      "statement": "A base jump reaches its apex in about 28 ticks.",
      "status": "estimate",
      "value": 28,
      "unit": "ticks",
      "confidence": "low",
      "tolerance": { "kind": "absolute", "value": 8, "unit": "ticks" },
      "method": "Counted 30 fps frames across visible rise intervals and converted each frame to approximately two simulation ticks; the two rows preserve lower and upper bounds.",
      "sources": ["footage-wcg", "footage-ssag"]
    },
    {
      "id": "player-ground-friction",
      "statement": "Releasing horizontal input damps ground velocity quickly without an immediate hard stop.",
      "status": "estimate",
      "value": 0.72,
      "unit": "velocity retained per tick",
      "confidence": "low",
      "tolerance": { "kind": "range", "value": [0.55, 0.85], "unit": "velocity retained per tick" },
      "method": "Provisional tuning hypothesis constrained by short settling motions; the selected footage does not expose a clean input-release timestamp.",
      "sources": ["footage-wcg", "footage-ssag"]
    },
    {
      "id": "player-rotation",
      "statement": "The circular body rotates visibly from contacts, recoil, and knockback while aim remains world-directed.",
      "status": "confirmed",
      "value": true,
      "unit": "rule",
      "confidence": "high",
      "tolerance": { "kind": "behavioral", "value": "body rotation does not rotate aim input", "unit": "behavior" },
      "method": "Observed independent body roll and gun aiming in both recordings.",
      "sources": ["footage-wcg", "footage-ssag"]
    },
    {
      "id": "player-base-regeneration",
      "statement": "Base players do not regenerate health during a duel.",
      "status": "confirmed",
      "value": 0,
      "unit": "health ratio per tick",
      "confidence": "medium",
      "tolerance": { "kind": "exact", "value": 0, "unit": "health ratio per tick" },
      "method": "Observed persistent damage between hits where no healing card was present.",
      "sources": ["footage-wcg", "footage-ssag"]
    }
  ]
}
